{
  "baseline": {
    "improvingCount": 1,
    "completedCount": 2,
    "sourceRef": "specs/008-dod-mech-refactor/artifacts/passes-rollup.md#baseline-1-2"
  },
  "entries": [
    {
      "passId": "pass-XX",
      "classification": "Improving",
      "regressionStatus": "None",
      "improvingCount": 2,
      "completedCount": 3,
      "improvementRatioPct": 66.67,
      "evidenceRefs": [
        "specs/009-raise-pass-improvement-ratio/artifacts/pass-XX/recovery-pass-artifact.json"
      ],
      "recordedAt": "2026-04-06T00:00:00Z"
    }
  ],
  "currentSummary": {
    "improvingCount": 2,
    "completedCount": 3,
    "improvementRatioPct": 66.67,
    "sc002Compliant": false
  },
  "updatedAt": "2026-04-06T00:00:00Z"
}

